{"attempt":1,"candidates":[{"content":{"kind":"text","text":"A blue sign marks the help desk."},"content_sha256":"6f527178d7d972e0487be9cbf62d4566f008b4cd2b149d51f92d0d9e6e0e8361","item_id":"desk-tip","source_id":"notes","source_revision":"note:alpha","target_key":"reference:desk-tip"}],"complete":true,"profile_sha256":"72ab078b7e7cb80b2fea7e951172a38d0cd645eeb73214d9ea3d5dfb8e4916b1","provider_id":"local-exact-lexical","qid":"fixture-1","reason":null,"security_scope_id":"reference-public","source_snapshot_refs":["1d4edf2a0ac6e245f01c25d917b71ab08b6b39b3c0c483d1ccf8e0d0dc080750"],"status":"ok","target_key":"reference:desk-tip","v":1}