{"attempt":1,"candidates":[{"content":{"kind":"text","text":"The help desk is in Room 12."},"content_sha256":"62f9ab47562f3e1f83967ead2344d53735db6e1ae7539b499a22b5920180e21b","item_id":"desk","source_id":"directory","source_revision":"edition:blue","target_key":"reference:desk"}],"complete":true,"profile_sha256":"72ab078b7e7cb80b2fea7e951172a38d0cd645eeb73214d9ea3d5dfb8e4916b1","provider_id":"local-exact-lexical","qid":"fixture-1","reason":null,"security_scope_id":"reference-public","source_snapshot_refs":["6d573a83e92c46861db4c974db5292a5ef4b8d2e02c83bdcfebfc2b18132d780"],"status":"ok","target_key":"reference:desk","v":1}